{
  "version":"1.0",
  "profile":"PATTERN-DECK-v1",
  "deck":{"title":"ED01–ED12 Pattern Resolver Demo","author":"OpenAI","lang":"ja-JP","defaultTheme":"TH01","defaultDensity":"MED","defaultComposition":"CM02","renderProfile":"PPT-SAFE-v1.3","fonts":{"jp":"Yu Gothic","latin":"Aptos"}},
  "slides":[
    {"id":"s01","pattern":"ED01-A","density":"LOW","theme":"TH01","composition":"CM01","content":{"kicker":"PATTERN RESOLVER / SAMPLE","title":"資料生成を、\nパターンから自動化する。","lead":"ED・Theme・CompositionをScene Graphへ解決し、HTML/PPTを同じ構造から描画する。","label":"COVERAGE","metric":"12","metricLabel":"pattern families"}},
    {"id":"s02","pattern":"ED02-D","density":"LOW","theme":"TH14","composition":"CM01","content":{"kicker":"ONE MESSAGE","claim":"テンプレートを増やせば、資料は良くなる。","reality":"必要なのは、内容に合わせて構造を選ぶ仕組み。"}},
    {"id":"s03","pattern":"ED03-D","density":"MED","theme":"TH10","composition":"CM03","content":{"kicker":"KEY NUMBER","title":"4つの指標を同時に見る","metrics":[{"value":"+12.8%","label":"売上"},{"value":"27.4%","label":"粗利率"},{"value":"6.2%","label":"売変率"},{"value":"18.1日","label":"在庫日数"}]}},
    {"id":"s04","pattern":"ED04-B","density":"MED","theme":"TH01","composition":"CM02","content":{"kicker":"THREE POINTS","title":"改善の3本柱","items":[{"title":"見える化","text":"KPIと例外を共通言語にする"},{"title":"標準化","text":"判断ルールを残す"},{"title":"自動化","text":"繰り返し処理を任せる"}]}},
    {"id":"s05","pattern":"ED05-D","density":"MED","theme":"TH03","composition":"CM02","content":{"kicker":"COMPARE","title":"現状から理想へ","current":{"label":"CURRENT","title":"属人的な作業","text":"集計・確認・資料化が担当者ごとに分断"},"ideal":{"label":"IDEAL","title":"再利用可能な仕組み","text":"データから報告資料まで同じパイプラインで生成"},"gap":"SYSTEM GAP"}},
    {"id":"s06","pattern":"ED06-B","density":"HIGH","theme":"TH04","composition":"CM03","content":{"kicker":"PROBLEM → SOLUTION","title":"課題を構造化して解く","problem":{"title":"作業が多い","text":"確認と転記に時間がかかる"},"cause":{"title":"情報が分散","text":"データ・判断・報告が別々"},"solution":{"title":"共通基盤","text":"Scene Graphまでを一本化"}}},
    {"id":"s07","pattern":"ED07-E","density":"MED","theme":"TH05","composition":"CM02","content":{"kicker":"FLOW","title":"人とAIを役割で分ける","stages":[{"role":"DATA","step":"取得・整形","output":"trusted data"},{"role":"AGENT","step":"分析・構成","output":"pattern request"},{"role":"HUMAN","step":"比較・選択","output":"approved scene"},{"role":"RENDER","step":"HTML / PPT","output":"deliverable"}]}},
    {"id":"s08","pattern":"ED08-C","density":"MED","theme":"TH10","composition":"CM02","content":{"kicker":"DATA STORY","title":"数字から、次の判断へ。","lead":"単なるグラフではなく、結論と注釈までをレイアウトに含める。","annotation":"伸長は後半に集中","chart":{"type":"column","categories":["Q1","Q2","Q3","Q4"],"series":[{"name":"Sales","values":[82,91,104,126]}]}}},
    {"id":"s09","pattern":"ED09-C","density":"MED","theme":"TH11","composition":"CM01","content":{"kicker":"MATRIX","title":"優先順位を2軸で決める","xLabel":"実行難易度 →","yLabel":"効果","highlight":"TR","quadrants":[{"title":"観察","text":"効果小 / 易"},{"title":"最優先","text":"効果大 / 易"},{"title":"保留","text":"効果小 / 難"},{"title":"大型案件","text":"効果大 / 難"}]}},
    {"id":"s10","pattern":"ED10-D","density":"MED","theme":"TH13","composition":"CM02","content":{"kicker":"TIMELINE","title":"今・次・その先を分ける","stages":[{"title":"NOW","text":"Pattern Resolverを安定化"},{"title":"NEXT","text":"Brief Resolverを接続"},{"title":"LATER","text":"CIとGolden QAを自動化"}]}},
    {"id":"s11","pattern":"ED11-B","density":"HIGH","theme":"TH02","composition":"CM03","content":{"kicker":"ACTION","title":"次の実装を明確にする","actions":[{"what":"Brief → Pattern選択","who":"Design Agent","when":"NEXT"},{"what":"Pattern coverage QA","who":"CI","when":"NEXT"},{"what":"Preference反映","who":"Resolver","when":"LATER"}]}},
    {"id":"s12","pattern":"ED12-A","density":"HIGH","theme":"TH05","composition":"CM03","content":{"kicker":"EVIDENCE","title":"生成から検証までの方法論","stages":[{"title":"Brief","text":"目的・相手・密度"},{"title":"Resolve","text":"ED / TH / CM"},{"title":"Scene","text":"0–100 geometry"},{"title":"Render","text":"HTML / PPT"},{"title":"QA","text":"Lint / PPT-SAFE"}]}}
  ]
}
